11141036,Two cases of Covid-19 variant identified in United States,0,low confidence,0.7880102168948948
11075324,Could Australia eliminate coronavirus as quickly as New Zealand might?,0,low confidence,0.7994316923627117
10000432,"Friday, 17th March 2000 {Adelaide Fringe guest, Joe Camilleri. Featured disc: Tony Coe, Alan Hacker}",0,outlier,0
10942146,Sydney weather: Heavy rain continues as drought-stricken NSW farmers celebrate,0,low confidence,0.802934864392814
10519292,Thai military vows 'leniency' in surrogacy cases,0,low confidence,0.8035128344313132
10703093,Black Caps trail after day three as Aussies end McCullum's final dig,0,low confidence,0.7962699953083339
10520952,"Australian economy slows less than feared, but income falls",0,random_remaining,0
10832429,Thousands of litres of oil to be removed as Hazelwood power station decommissioning continues,0,low confidence,0.8053141018531902
11037282,Wanpla petisen bai askim ol lidas na pipol blong Hela long stopim pasin blong kilim idai ol pablik sevans,0,outlier,0
10481653,Quinton de Kock hits third consecutive ODI century as South Africa,0,low confidence,0.7917646426490199
10777677,Indonesia accuses Pacific nations of 'misusing' the UN after Papua criticisms,0,low confidence,0.8009172620194923
10608141,Giant Magellan Telescope: Largest ever telescope one step closer to being built,0,random_remaining,0
11098196,"Meski Sudah Menewaskan Hampir Setengah Juta Orang Dunia, Inilah Komunitas yang Belum Pernah Mendengar Soal Virus Corona",0,outlier,0
10978683,Review into ATO's debt collection tactics finds there was 'no cash grab',0,low confidence,0.8074418755080843
10408384,Pokies revenue rises as carbon compo arrives,0,low confidence,0.763599857378455
10971397,"Bookie under fire after punter won $29,000 on bet made after race was finished",0,low confidence,0.7885099452132832
10875055,"Menteri Utama Queensland, Annastacia Palaszczuk mengatakan ia tidak keberatan membuat kue untuk pasangan gay.",0,outlier,0
10155057,Food price rises are mass murder: UN envoy,0,low confidence,0.7913840972637848
10789915,"Hazelwood power station closure could affect supply, power prices in other states: Josh Frydenberg",0,low confidence,0.799375568667802
11164751,"Ballarat courier Paper Freight enters survival mode, as parent company loses major News Corp contract",0,low confidence,0.8056763950803895
11033281,"Recycling in tatters, as some councils give up on glass collection",0,low confidence,0.8032637829137443
10802633,Melbourne Metro passenger trains stuck in the dark in city loop following power fault,0,low confidence,0.8027346109192027
10792816,"National Disability Insurance Scheme struggling to meet enrolment targets, report shows",0,random_remaining,0
10898045,"South Africa v Australia: Second Test in Port Elizabeth, day one as it happened",0,low confidence,0.7701921044199105
10218786,WHO rejects 'lab-made' swine flu theory,0,low confidence,0.7952600960923227
10636616,Hunter Valley woman appears in Cessnock court charged with injecting daughter with urine,0,random_remaining,0
10375312,Woman still in hospital after unit blaze,0,low confidence,0.7772946495646523
10755441,Explosions heard as fire destroys Melbourne car parts factory,0,low confidence,0.7944288961396668
10175432,THE 40 YEAR OLD BUSHWALKER FOUND HIS OWN WAY OUT THIS MORNING  ...RE-UNITED WITH HIS BEST FRIEND THIS AFTERNOON.,0,outlier,0
10834527,Report suggests filling in parts of smelly lake near former SA power station,0,low confidence,0.8050082773242611
10737230,River Murray houseboat gutted in early morning blaze,0,low confidence,0.782558852268142
10056307,Woman survives Horsham house blaze,0,low confidence,0.7859097271675819
10411194,UN: Philippines needs birth control law,0,low confidence,0.8013710081545874
10259650,Local nurse returns after fighting Ebola outbreak,0,low confidence,0.7886465730325123
10355349,Uproar after toga party in Russian jail,0,random_remaining,0
11146783,Pesawat Luar Angkasa Milik Uni Emirat Arab Telah Mencapai Mars Untuk Mempelajari Kondisi dan Iklim Planet Tersebut,0,outlier,0
10197114,Clarke fires as injuries cruel Proteas,0,low confidence,0.8016313710297848
10959949,"Forty killed in Afghanistan after gunmen storm Kabul government office, 29 wounded",0,low confidence,0.7950947214157201
10934640,"Gempa Bumi 7,1 Skala Richter Guncang Kaledonia Baru, Picu Tsunami Kecil Di Kepulauan Pasifik Selatan",0,outlier,0
11076160,"The Spirits on the move, Tasmania powering the nation and supermassive black holes",0,random_remaining,0
10839083,"Scott Johnson death: Reports gay men bashed, killed at Manly's North Head, inquest hears",0,random_remaining,0
10503809,Fire crews find body in Portland shed blaze,0,low confidence,0.7306216427937435
11081207,Stephanie McCallum plays Constant Lambert's Trois PiÃƒÂ¨ces nÃƒÂ¨gres pour les touches blanches: I. Aubade,0,outlier,0
10555816,Surge in drones as Christmas gifts poses fire risk: peak body,0,low confidence,0.8067817165245229
10406800,Experts probe house blaze,0,low confidence,0.7979545235477576
11076517,"WHO unsure antibodies protect against COVID-19, as countries roll out coronavirus testing",0,low confidence,0.5245479605268013
10456074,"800,000 people hit the streets as Brazil protests ramp up",0,low confidence,0.571831703688086
10201425,More manpower as fire threat warms up,0,low confidence,0.5500962783980499
10858560,North Korea: UN Security Council unanimously adopts new sanctions over nuclear test ,0,low confidence,0.5860107991876996
10951102,Aboriginal children as young as 11 strip searched,0,low confidence,0.5700365751379142
10494903,Police says St Martin's Lutheran College blaze suspicious,0,low confidence,0.5187060024991639
10546273,Family of seven escapes blaze at Perth hills home,0,low confidence,0.5230728061773582
10537902,World War Two veteran finds justice after 70-year battle,0,low confidence,0.5121161532556757
10779857,"NSW weather: Damaging winds cause power cuts to thousands of homes, businesses",0,low confidence,0.5869657122389247
11117659,Mistakes in 'shambolic' hotel quarantine program laid bare after three weeks of evidence in inquiry,0,low confidence,0.5457824574443049
10625112,Native wood waste hoped to fire up Tasmanian energy industry as environmentalists oppose biomass as renewable energy,0,low confidence,0.5599104013003882
10809583,"Energy bills may be set to jump due to changing LNG export market, economist says",0,random_remaining,0
10903187,Rare dinosaur footprints found on Scotland's Isle of Skye 'globally important',0,random_remaining,0
10716026,Five confirmed cases in Torres Strait dengue outbreak,0,low confidence,0.5041716298810759
10669138,"Paris attacks: Bataclan theatre survivor Massimiliano Natalucchi recalls escape, moment terrorists stormed concert",0,outlier,0
11080084,"WA records ninth coronavirus fatality with death of 83yo woman, but no new cases",0,low confidence,0.5955760761065811
10208496,Jobless figures not as bad as expected: QCCI,0,low confidence,0.5650002136722206
10576947,William Tyrrell search continues as town asks if one of their own is responsible,0,low confidence,0.5978369246602246
10812027,Romanian protests: Thousands hit streets as Government rejects calls to withdraw corruption decree,0,low confidence,0.5036698482284435
11071186,Wall Street surge as US coronavirus rescue package expected ,0,low confidence,0.5019342357320971
10603452,Explosion fear prompts exclusion zone around Kempsey house fire,0,low confidence,0.5718113375900119
11129607,Program Lumbung Pangan Nasional Ancam Ketahanan Pangan Berbasis Kearifan Lokal Masyarakat Adat Nusantara,0,outlier,0
10055223,Lights opponents claim roundabouts safer,0,random_remaining,0
10307379,Nitrogen fertilisers doing as much harm as good,0,low confidence,0.5313777597409287
10807740,South Australia endures another sweltering day of 40C as summer hits its stride,0,low confidence,0.5440769102955154
10251324,Police arrest owner over deadly club blaze,0,low confidence,0.5558104473077603
10159136,Market buoyed as mining shares hit new highs,0,low confidence,0.5054438222186912
10618444,Queensland's corruption watchdog gets new acting head as political stalemate continues,0,low confidence,0.5107625323918372
10243171,Film set burns in bushfire,0,low confidence,0.5539846698984165
11070354,New South Wales reaches more than 500 cases of COVID-19 with 97 new infections,0,low confidence,0.5220357977489783
11022946,"Status Udara ""Berbahaya"" Akibat Kabut Asap Pekat Karhutla, Jambi Liburkan Sekolah Selama Sepekan",0,outlier,0
11141534,"Presiden Joko Widodo Teken PP Kebiri Kimia, Pengamat Menilai Tak Efektif Cegah Kekerasan Seksual",0,outlier,0
10818660,Tomato potato psyllid: Insect found outside Perth quarantine zone on three commercial properties,0,low confidence,0.5422167147574546
10124477,Govt to foot bill for sports drug tests,0,random_remaining,0
11085713,Coronavirus cases at Melbourne aged care home increase as two workers test positive,0,low confidence,0.5765054982902611
10741156,Out of season death cap mushrooms predicted in ACT,0,low confidence,0.5570738971375448
11140829,"NSW records three new COVID cases, all linked to Avalon cluster",0,low confidence,0.5470811798888522
11040142,"Gunakan Lukisan Tiruan Tanpa Izin, Aktor Ricky Gervais Bayar Ganti Rugi Ke Seniman Aborijin",0,outlier,0
11164688,TGA investigating three new blood clot cases in people given AstraZeneca vaccine,0,low confidence,0.5834114902530063
10477206,Buswell rules out use of toll roads,0,low confidence,0.5420579059631876
10034306,"NSW, Vic accidents raise road toll",0,low confidence,0.5030745524021014
11150039,Qantas Berharap Bisa Mulai Penerbangan Internasional Pada Bulan Oktober ke Lebih Banyak Negara Tujuan,0,outlier,0
10538357,US nurse defies Ebola quarantine,0,low confidence,0.5968795923172138
10372530,Mayor on board with rail service push,0,random_remaining,0
10344623,Park officials introduce e-tickets for Uluru,0,random_remaining,0
10401063,Reds into ACL quarter-finals,0,random_remaining,0
10678101,Gold Coast chasing Tim Lafai as James Roberts replacement,0,low confidence,0.5998257847248694
10119498,Properties identified as possible horse flu hot spots,0,low confidence,0.5157928085353516
10035564,Pilgrims' hostel collapse toll reaches 53,0,low confidence,0.5740759525785253
10692749,Live cattle export ships prepare in Townsville port as season ramps up,0,low confidence,0.5799206748273872
10011565,Indonesia confirms first bird flu deaths,0,low confidence,0.5697427474092454
10659888,Probe into Sunshine Coast water tower collapse likely to take six months,0,low confidence,0.5650089774246618
11131867,Why Melbourne's coronavirus reopening is on hold as regional Victoria steps forward,0,low confidence,0.5133985643279276
10596342,Thieves ransack SES cars outside Hunter Valley hotel while storm response team sleeps,0,low confidence,0.5742686984135212
10825300,NSW Government privatisation plans leave people with disabilities in uncertainty,0,random_remaining,0
11145165,"Menjelang Pertemuan Parlemen Baru Hasil Pemilu, Pemimpin Myanmar Aung San Suu Kyi 'Diculik'",0,outlier,0
10615657,War crimes likely by both sides in 2014 Gaza war: UN report,0,low confidence,0.5155878506286053
11150635,"Perth property prices surge as Kwinana, Mandurah, Belmont, Victoria Park lead the way",0,low confidence,0.5559714482133647
11142377,"Sebagai Prioritas Penerima Vaksin, Tenaga Kesehatan Mengaku Siap Tapi Khawatir Protokol Kesehatan Mengendur",0,outlier,0
11068642,Queensland senator tests positive to COVID-19 as state case tally rises again,0,low confidence,0.5339222106276209
10881073,Monday Business PM,0,random_remaining,0
10091534,UN Security Council extends East Timor mission,0,low confidence,0.56926422172956
10023242,UN elects new Security Council members,0,low confidence,0.529329945125883
10272789,Timber power plan under fire,0,low confidence,0.5989976856378157
10561513,Two hundred jobs axed as WA lead mine closes,0,low confidence,0.5048038175166818
10384542,Moree floods ease as threat moves west,0,low confidence,0.524721817756017
10990895,"Bodies of mother and 10-year-old found in Tenerife cave, father arrested after younger son found wandering alone",0,random_remaining,0
10129675,New season of '24' hit by US writers strike,0,low confidence,0.576190877900522
11102045,Six new aged care COVID deaths in Victoria,0,low confidence,0.560721645170625
10722800,Bicycle Day marks LSD discovery by Albert Hoffman as psychotherapy research continues,0,low confidence,0.5616560909920076
10825566,Seven seriously injured as fast train hits flat-bed truck in Poland,0,low confidence,0.5734489330572224
10523914,Ebola cases doubling every two weeks in worst areas,0,low confidence,0.5474193819140991
10988880,Bos Alibaba Jack Ma Sebut Staf Harus Bekerja 12 Jam Sehari 6 Hari Seminggu,0,outlier,0
10261091,National road toll rises to 62,0,low confidence,0.5221598742246101
10329558,Ross River virus cases on the rise after floods,0,low confidence,0.570011042110249
10660500,"Gear S2 Smartwatch vs. Apple Watch, Facebook M, Until Dawn interview, horror games",0,outlier,0
10180760,Dry windy weather taking toll on crops,0,low confidence,0.5341098440112053
10701894,Unemployment down in WA as national rate rises,0,low confidence,0.543188015877246
10590734,Housing shortage not as certain as we think,0,low confidence,0.556674593961248
10411082,Petersen hits out as Proteas take control,0,low confidence,0.5381068619807691
10106148,NSW ministers to defy church over stem cell research,0,random_remaining,0
10254818,Drugs found at police station,0,random_remaining,0
10638144,Working dogs and their handlers: Monica and Chloe,0,random_remaining,0
10969415,"Perth woman conned out of $468,500 in romance scam linked to Dubai hotel project",0,random_remaining,0
11028769,Australian fish in safe hands,0,random_remaining,0
10956416,Chaos in parliament on final sitting day,0,cluster_member,0.42820990085601807
10373560,Doctors pull 28 nails from girl's body,0,cluster_member,0.43053287267684937
10501918,Couple denies manslaughter charge over relative's death,0,cluster_member,0.3332459330558777
10915335,"JetGo enters voluntary administration, cancels all regional flights amid legal battle",0,cluster_member,0.21926990151405334
10122818,Countries call for restraint after Burma protest warning,0,cluster_centroid,0.6759818196296692
10246980,AXA up 34pc after rejecting AMP takeover bid,0,cluster_member,0.39911484718322754
10888100,Gin and Lewis: Hottest 100 cocktails from the textline,0,cluster_member,0.5853138566017151
10890188,Money Changer di Dubai Diduga Jadi Saluran Pencucian Uang,0,cluster_centroid,0.654266357421875
10608967,"Proposed anti-bikie laws similar to anti-terrorism measures, SA attorney-general says",0,cluster_member,0.4506605863571167
10572405,Perth's new Fiona Stanley Hospital grapples with unexpected jump in number of emergency patients: doctor,0,cluster_member,0.4439791142940521
10548509,"The Internet: the good, the bad and the uglyÃ‚Â ",0,cluster_centroid,0.8151078224182129
10970910,The Drum Wednesday February 13,0,cluster_member,0.29893940687179565
11023404,Best Advice: Lulu Wang,0,cluster_member,0.05563072860240936
10439113,Six in custody after more murder arrests  ,0,cluster_member,0.4236457347869873
10908571,Labor welcomes additional funding pledged by Federal Government to restore Great Barrier Reef ,0,cluster_member,0.31696078181266785
10780744,Sleep tips for worrywarts,0,random_remaining,0
10924994,Vinyl Sides,0,cluster_outlier,0.9706152305006981
10383254,Thomson Fair Work probe nears conclusion,0,cluster_member,0.18078230321407318
10632923,"NRL secures new free to air television deal with Channel Nine, Origin match to be played on Sunday from 2018",0,cluster_centroid,0.6926555037498474
10552108,Fiji government amends Land Sales Act to restrict foreign property ownership,0,random_remaining,0
10005708,Honey Wheat Loaf,0,cluster_outlier,0.9520628526806831
11052192,Christmas turkey deliveries made more difficult because of farmer's phone troubles,0,cluster_centroid,0.7510467171669006
10808290,Seasickness and science: Are your 'sea legs' in your brain or your muscles?,0,cluster_outlier,0.7331134676933289
10569342,Man faces charges after 42-hour Launceston siege comes to an end,0,cluster_member,0.34593284130096436
10902490,"The Conversation Hour:  Mark Seymour, Jack Levi (aka Elliot Goblet), and Vince Sorrenti with Dave Hughes",0,cluster_member,0.36565038561820984
10289579,Chocolate caramel slice,0,cluster_centroid,0.7966169118881226
10785353,Work struggle for former FIFO worker as thousands of full-time WA jobs lost,0,cluster_member,0.5338903665542603
10929491,"Ben Stokes trial: England cricketer mocked gay men before alleged assault, court hears",0,cluster_member,0.2657105028629303
10658090,"Pregnant asylum seeker returned to Nauru over change of mind, PM says",0,cluster_member,0.431478351354599
10203915,Symonds injured as Redbacks make solid start,0,cluster_centroid,0.5506215691566467
11073524,"APS in action, Captain Cook, The Pick",0,cluster_member,0.3870912492275238
11104232,"Chief Public Health Officer Nicola Spurrier's advice was overruled, parliamentary committee hears",0,cluster_member,0.12783510982990265
10354719,Reds re-sign veteran forwards,0,cluster_member,0.07791813462972641
10764822,Indigenous leaders plead for prison alternatives for NT youth ahead of Wave Hill walk-off anniversary,0,cluster_centroid,0.7587456107139587
10679395,Mick Fanning makes dream start at Pipe Masters while nearest rivals Filipe Toledo and Adriano de Souza face elimination heats,0,cluster_outlier,0.7493969202041626
10306396,Rate rise will kill Christmas: retailers,0,cluster_member,0.2872191369533539
11136957,Henny Penny,0,cluster_outlier,0.9865923458710313
10259378,Woodford Folk Festival,0,cluster_member,0.5356355309486389
10538138,Tasmania's anti-protest laws pass Upper House hurdle,0,cluster_centroid,0.325909823179245
10060283,Steamed pudding,0,cluster_outlier,0.9872406125068665
11142300,Damaged livestock ship banned from using Australian ports for two years,0,cluster_member,0.5922311544418335
10792569,Why Marlowe co-wrote Shakespeare's Henry VI,0,cluster_member,0.10016366094350815
10019253,GPA supports Oakajee deep water port,0,cluster_member,0.21206632256507874
10479279,Indonesia spying letter hand-delivered by former Army chief,0,cluster_member,0.24795526266098022
10191248,McGrath honoured as NSW Australian of the Year,0,cluster_member,0.5395715236663818
10095123,Summit rejects Paladin's $1b takeover bid,0,cluster_outlier,0.9280930608510971
10466629,Natural Muesli,0,cluster_outlier,0.9606631360948086
10544232,"Jacqui Lambie demoted as deputy Senate leader, deputy whip of Palmer United Party",0,cluster_outlier,0.722730964422226
10676867,Senate inquiry told foreign flagged ships could pose terror risk,0,cluster_member,0.18648971617221832
11025822,Dodgy Donations,0,cluster_outlier,0.9757098946720362
10824418,Guilty Pleasures,0,cluster_outlier,0.9634207263588905
10994526,"Over the Hunter, with the eagles",0,cluster_centroid,0.7196251749992371
10531927,"NT grants 'major project status' to 1,000km gas pipeline",0,cluster_member,0.6315725445747375
10078872,Bush praises Indonesia,0,cluster_member,0.17576953768730164
10019452,Claims of sexual harrassment aired in NZ campaign.,0,cluster_member,0.4021051228046417
11061350,Anthony Albanese: 'This is an absolute wreck of a government',0,cluster_centroid,0.6676303148269653
10150330,Tasmanian student off to Gallipoli,0,cluster_centroid,0.7485147714614868
10295711,Court rules workplace unsafe,0,cluster_member,0.4269154965877533
10777571,The Big Lez Show and The Mike Nolan Show bring crude cartoon fame to young trio,0,cluster_outlier,0.6605170965194702
10382858,Windschuttle an authority on constitutional law?,0,cluster_member,0.3947865068912506
10358859,Train maintenance facility on track,0,cluster_member,0.42610713839530945
10882209,"Priest, detective, lover",0,cluster_outlier,0.9595277681946754
10873143,Explain This: Wine,0,cluster_outlier,0.9627147614955902
11016180,"ASX to rise, Wall Street boosted by US-China trade optimism and strong earnings ",0,cluster_member,0.39562705159187317
10886202,Weekend Lunch,0,cluster_outlier,0.9714763928204775
10684735,Child care groups fear Fed Gov overhaul may force closure of remote centres,0,cluster_centroid,0.8281254172325134
10869512,SA Police release 'horrific' details of injuries to 11mo Dylan Lindsay in bid to 'spark a conscience',0,cluster_centroid,0.656982421875
10683658,Popularity of Tasmanian devil cartoon character helps researchers raise funds to save species,0,cluster_member,0.41159698367118835
10299700,Libs claim Labor-Green deal costing jobs,0,random_remaining,0
10479207,Australian population to double more quickly than expected: ABS,0,cluster_member,0.6188021898269653
10935297,Australia's largest maritime exercise underway with China participating for first time,0,cluster_member,0.490455687046051
10545718,Praise for state's new Corrective Services Aboriginal Advisory Council,0,cluster_member,0.41528287529945374
10976098,'Boiler Room kings': Fans and musicians mourn Keith Flint,0,cluster_member,0.3211618959903717
10475919,When ministers operate on a wink and a nudge,0,cluster_centroid,0.7631301879882812
10631755,Qld students most improved in NAPLAN: preliminary results,0,cluster_member,0.3797178268432617
10616947,Yemen 'one step away from famine' amid stalled ceasefire talks,0,cluster_outlier,0.7408163845539093
10898034,School community shocked at Trinity sacking,0,cluster_member,0.28047794103622437
10377962,Kuzimski found guilty of double murder,0,cluster_centroid,0.7705691456794739
10946443,Yo-Kai Watch 2,0,cluster_outlier,0.9240795224905014
10474449,Fears City Place revamp hurting Lake St traders,0,cluster_member,0.13631242513656616
10619254,Champix probe: Queensland coroner reopens investigation into anti-smoking drug's possible link to 22yo man's suicide,0,cluster_outlier,0.6144102215766907
10536640,"Kurtley Beale returns to training, aiming for Wallabies call-up after Di Patston text message scandal",0,cluster_outlier,0.6259909272193909
11016600,UAE could use Australian weapons systems in attacks against Yemen,0,cluster_member,0.3902464210987091
10411844,Toyota recalls Aurion and Camry models,0,random_remaining,0
10143810,Fire rips through London's Camden Market,0,cluster_member,0.1533002406358719
10623278,New Zealand launches appeal over Olympic expulsion,0,cluster_member,0.3375737965106964
10830039,Foodie Tuesday: Pumpkin,0,cluster_member,0.088325634598732
11037830,Woman dies after fire truck and car collide in 'horrific' Canberra crash,0,cluster_member,0.42756766080856323
10615610,Armidale Court House Land Claim offset deal considered,0,random_remaining,0
10534672,Business in 90 Seconds,0,cluster_member,0.501686692237854
10001481,The U.S. In The Philippines,0,cluster_member,0.397612988948822
10791500,Summer time: What illnesses should we look out for?,0,cluster_member,0.23063772916793823
10237893,Blaze rips through Bulli house,0,cluster_member,0.3011878430843353
10646453,"Andrew Hastie speaks to Malcolm Turnbull, Tony Abbott",0,cluster_member,0.37587031722068787
10069583,Labor attacks Govt over 'false' horticultural code promise,0,cluster_member,0.36306148767471313
10541193,Tasmanian tourism awards showcase industry's leading lights,0,cluster_centroid,0.7620915174484253
10337361,Brawl outside 'black magic' rape sentencing,0,cluster_member,0.16895242035388947
10864764,Room sharing is the new flat sharing,0,cluster_member,0.4033847153186798
